,TRANSMITTALNO,ISSUEPURPOSE,PLANNEDCLIENTRETURNDATE,ISSUEDATE,DOCVERSIONNO,DOCVERSIONDESC,DOCREV,DOCCLASS,TRDESC,CLIENTDOCNO,LE,ISSNO
0,TPC-TC(C0)-CD-22-0048,IFA,2022/02/14,2022/01/14,XB41A-00000-001,HAZARDOUS AREA SOURCE RELEASE,A,A,HAZARDOUS AREA CLASSIFICATION,TC0-0-AZE02-D5015,程正維  Ext.:28057,EE-0038
1,TPC-TC(C0)-CD-22-0048,IFA,2022/02/14,2022/01/14,XB41A-0BOP0-001,HAZARDOUS AREA CLASSIFICATION FOR OTHERS,A,A,HAZARDOUS AREA CLASSIFICATION,TC0-0-AZE02-D5014,程正維  Ext.:28057,EE-0038
2,TPC-TC(C0)-CD-22-0048,IFA,2022/02/14,2022/01/14,XB41A-0DWT0-001,"HAZARDOUS AREA CLASSIFICATION FOR DEMINERALIZED & RECOVERY WATER SYSTEM, AMMONIA STORAGE WAREHOUSE, LUBE OIL STORAGE AREA, AND GT SPRAY WATER SYSTEM",A,A,HAZARDOUS AREA CLASSIFICATION,TC0-0-AZE02-D5012,程正維  Ext.:28057,EE-0038
3,TPC-TC(C0)-CD-22-0048,IFA,2022/02/14,2022/01/14,XB41A-0EDG0-001,"HAZARDOUS AREA CLASSIFICATION FOR EDG, GAS TURBINE MAINT. SHOP, WASTEWATER TREATMENT PLANT, AND SPARE/ HEAVEY PARTS/ LUBE OIL STORAGE WAREHOUSE",A,A,HAZARDOUS AREA CLASSIFICATION,TC0-0-AZE02-D5011,程正維  Ext.:28057,EE-0038
4,TPC-TC(C0)-CD-22-0048,IFA,2022/02/14,2022/01/14,XB41A-0SEH0-001,HAZARDOUS AREA CLASSIFICATION FOR SEAWATER ELECTROLYSIS HOUSE AND CIRCULATING WATER PUMPS,A,A,HAZARDOUS AREA CLASSIFICATION,TC0-0-AZE02-D5013,程正維  Ext.:28057,EE-0038
