,TRANSMITTALNO,ISSUEPURPOSE,PLANNEDCLIENTRETURNDATE,ISSUEDATE,DOCVERSIONNO,DOCVERSIONDESC,DOCREV,DOCCLASS,TRDESC,CLIENTDOCNO,LE,ISSNO,DOCDOCCLASS
0,TPC-TC(C0)-CD-22-1006,IFA,2022/10/04,2022/09/05,XK72C-00000-001,SECURITY SYSTEM LEGEND AND NOTES,A,A,SECURITY SYSTEM,TC0-1-IUE02-D5101,程正維  Ext.:28057,EE-0285,A
1,TPC-TC(C0)-CD-22-1006,IFA,2022/10/04,2022/09/05,XK72C-0KEY0-001,SECURITY SYSTEM LAYOUT MAIN ROUTING AND DRAWING INDEX,A,A,SECURITY SYSTEM,TC0-1-IUE02-D5103,程正維  Ext.:28057,EE-0285,A
2,TPC-TC(C0)-CD-22-1006,IFA,2022/10/04,2022/09/05,XK72C-0SYS0-001,SECURITY SYSTEM BLOCK DIAGRAM,A,A,SECURITY SYSTEM,TC0-1-IUE02-D5102,程正維  Ext.:28057,EE-0285,A
3,TPC-TC(C0)-CD-22-1006,IFA,2022/10/04,2022/09/05,XK72C-1CCS0-001,SECURITY SYSTEM LAYOUT FOR ST ELECTRONIC EQUIPMENT BUILDING OF C/C UNIT #1,A,A,SECURITY SYSTEM,TC1-1-IUE02-D5131,程正維  Ext.:28057,EE-0285,A
4,TPC-TC(C0)-CD-22-1006,IFA,2022/10/04,2022/09/05,XK72C-1EEB0-001,SECURITY SYSTEM LAYOUT FOR GT ELECTRICAL BUILDING OF C/C UNIT #1,A,A,SECURITY SYSTEM,TC1-1-IUE02-D5111,程正維  Ext.:28057,EE-0285,A
