,TRANSMITTALNO,ISSUEPURPOSE,PLANNEDCLIENTRETURNDATE,ISSUEDATE,DOCVERSIONNO,DOCVERSIONDESC,DOCREV,DOCCLASS,TRDESC,CLIENTDOCNO,LE,ISSNO
0,TPC-TC(C0)-CD-22-0083,IFA,2022/02/28,2022/01/28,XF11B-0000-601,PLUMBING SYSTEM SYMBOLS AND ABBREVIATIONS,B,A,PB Standard Drawing_RB,TC0-1-CYC02-D5601,陳博仁  Ext.:23341,CB-0140
1,TPC-TC(C0)-CD-22-0083,IFA,2022/02/28,2022/01/28,XF11B-0000-602,PLUMBING SYSTEM GENERAL NOTES,B,A,PB Standard Drawing_RB,TC0-1-CYC02-D5602,陳博仁  Ext.:23341,CB-0140
2,TPC-TC(C0)-CD-22-0083,IFA,2022/02/28,2022/01/28,XF11B-0000-603,PLUMBING SYSTEM TYPICAL FOR PIPING INSTALLATION DETAILS,B,A,PB Standard Drawing_RB,TC0-1-CYC02-D5603,陳博仁  Ext.:23341,CB-0140
3,TPC-TC(C0)-CD-22-0083,IFA,2022/02/28,2022/01/28,XF11B-0000-604,PLUMBING SYSTEM EQUIPMENT INSTALLATION DETAILS SHEET 1 OF 3,B,A,PB Standard Drawing_RB,TC0-1-CYC02-D5604,陳博仁  Ext.:23341,CB-0140
4,TPC-TC(C0)-CD-22-0083,IFA,2022/02/28,2022/01/28,XF11B-0000-605,PLUMBING SYSTEM EQUIPMENT INSTALLATION DETAILS SHEET 2 OF 3,B,A,PB Standard Drawing_RB,TC0-1-CYC02-D5605,陳博仁  Ext.:23341,CB-0140
5,TPC-TC(C0)-CD-22-0083,IFA,2022/02/28,2022/01/28,XF11B-0000-606,PLUMBING SYSTEM EQUIPMENT INSTALLATION DETAILS SHEET 3 OF 3,B,A,PB Standard Drawing_RB,TC0-1-CYC02-D5606,陳博仁  Ext.:23341,CB-0140
6,TPC-TC(C0)-CD-22-0083,IFA,2022/02/28,2022/01/28,XF11B-0000-607,PLUMBING SYSTEM PIPING SUPPORT & TYPICAL DETAIL SHEET 1 OF 2,B,A,PB Standard Drawing_RB,TC0-1-CYC02-D5607,陳博仁  Ext.:23341,CB-0140
7,TPC-TC(C0)-CD-22-0083,IFA,2022/02/28,2022/01/28,XF11B-0000-608,PLUMBING SYSTEM PIPING SUPPORT & TYPICAL DETAIL SHEET 2 OF 2,B,A,PB Standard Drawing_RB,TC0-1-CYC02-D5608,陳博仁  Ext.:23341,CB-0140
